{
  "campaign_manifest_id": "rcid:v1:campaign-manifest:h:jcs-sha256-v1:0000000000000000000000000000000000000000000000000000000000000001",
  "count_derivation_revision_id": "rcid:v1:assertion-derivation-revision:h:jcs-sha256-v1:df951ea724e09fa6126b85a43613d7fe41e558c51a6197d72a2792a1aed8b95f",
  "counts": {
    "inconclusive_attempt_count": 3,
    "logical_execution_count": 5,
    "physical_attempt_count": 8,
    "recovered_attempt_count": 1,
    "repeat_measurement_attempt_count": 1,
    "retry_attempt_count": 2,
    "terminal_attempt_count": 5,
    "terminal_observation_count": 5
  },
  "execution_policy_revision_sha256": "c0095c600d03cc7f17012990d46e54b3e874a8f2cae4aa1a052f9953637b0a3a",
  "lineage_set_sha256": "21f309e2b846a4d62184419e4780d630bbfb484a7498fc08a3bc91282359d852",
  "lineages": [
    {
      "attempts": [
        {
          "attempt_ordinal": 1,
          "attempt_purpose": "initial",
          "checkpoint_context": {
            "controller_session_id": "reference-session-1",
            "predecessor_checkpoint_sha256": null,
            "recovery_action": "start",
            "start_checkpoint_sha256": "00000000000000000000000000000000000000000000000000000000000003e9",
            "start_state": "running"
          },
          "ended_at": "2026-09-06T12:01:01Z",
          "execution_context": {
            "adapter_release_id": "rcid:v1:adapter-release:u7:019ffdee-0000-7000-8000-000000000001",
            "adapter_release_manifest_id": "rcid:v1:adapter-release-manifest:h:jcs-sha256-v1:0000000000000000000000000000000000000000000000000000000000000001",
            "applicability_coordinate_id": "rcid:v1:applicability-coordinate:h:jcs-sha256-v1:0000000000000000000000000000000000000000000000000000000000000001",
            "campaign_id": "rcid:v1:campaign:u7:019ffdee-0000-7000-8000-000000000001",
            "campaign_manifest_id": "rcid:v1:campaign-manifest:h:jcs-sha256-v1:0000000000000000000000000000000000000000000000000000000000000001",
            "control_plane_revision_sha256": "0000000000000000000000000000000000000000000000000000000000000002",
            "environment_fingerprint_id": "rcid:v1:environment-fingerprint:h:jcs-sha256-v1:0000000000000000000000000000000000000000000000000000000000000001",
            "environment_realization_id": "rcid:v1:environment-realization:u7:019ffdee-0000-7000-8000-000000000001",
            "execution_policy_revision_sha256": "c0095c600d03cc7f17012990d46e54b3e874a8f2cae4aa1a052f9953637b0a3a",
            "execution_shard_id": "rcid:v1:shard:h:jcs-sha256-v1:0000000000000000000000000000000000000000000000000000000000000001",
            "harness_revision_sha256": "0000000000000000000000000000000000000000000000000000000000000003",
            "partition_id": null,
            "profile_revision_id": "rcid:v1:profile-revision:h:jcs-sha256-v1:0000000000000000000000000000000000000000000000000000000000000001",
            "protocol_revision_id": "rcid:v1:adapter-protocol-revision:h:jcs-sha256-v1:0000000000000000000000000000000000000000000000000000000000000001",
            "target_release_revision_id": "rcid:v1:release-revision:h:jcs-sha256-v1:0000000000000000000000000000000000000000000000000000000000000001",
            "vector_revision_id": "rcid:v1:vector-revision:h:jcs-sha256-v1:0000000000000000000000000000000000000000000000000000000000000001",
            "work_unit_id": "rcid:v1:shard:h:jcs-sha256-v1:0000000000000000000000000000000000000000000000000000000000000065"
          },
          "expected_intermittence": {
            "declared": false,
            "source_reference": null
          },
          "logical_execution_id": "rcid:v1:logical-execution:h:jcs-sha256-v1:0000000000000000000000000000000000000000000000000000000000000001",
          "physical_run_id": "rcid:v1:physical-run:u7:019ffdee-0000-7000-8000-000000000001",
          "physical_telemetry_references": [
            {
              "category": "physical-telemetry",
              "relative_path": "physical-telemetry/sha256/0000000000000000000000000000000000000000000000000000000000000001.json",
              "sha256": "0000000000000000000000000000000000000000000000000000000000000001",
              "size_bytes": 1
            }
          ],
          "predecessor_physical_run_id": null,
          "repeat": null,
          "reset": {
            "evidence_references": [],
            "reason_code": "initial-state",
            "scope": "none"
          },
          "resource_budget": {
            "cpu_time_ms": 500,
            "memory_bytes": 67108864,
            "process_count": 4,
            "stderr_bytes": 65536,
            "stdout_bytes": 65536,
            "wall_time_ms": 1000
          },
          "retry": null,
          "schema_version": "physical-attempt-evidence.v2",
          "started_at": "2026-09-06T12:01:00Z",
          "terminality": {
            "disposition": "terminal-scientific-observation",
            "fault_attribution": {
              "attribution_layer": "target",
              "evidence_reference": null,
              "reason_code": "bounded-target-evidence",
              "target_attributable": true
            },
            "observation_complete": true,
            "outcome_class": "match",
            "produced_observation_id": "rcid:v1:observation:u7:019ffdee-0000-7000-8000-000000000001",
            "protocol_status": {
              "last_checkpoint": "target-response-complete",
              "state": "valid"
            },
            "protocol_valid": true,
            "scientific_result_signature": {
              "algorithm": "rfc8785-sha256-v1",
              "basis": "outcome-class-and-semantic-result",
              "sha256": "ca01757df60734eabb5ef43c7d4674ee2a5bec519409a15c0ac746c291194cf1"
            },
            "semantic_result": {
              "match": true,
              "spans": [
                [
                  0,
                  1
                ]
              ]
            },
            "target_process_status": {
              "exit_code": 0,
              "resource_limit": null,
              "signal": null,
              "target_started": true,
              "timeout_source": null
            }
          }
        }
      ],
      "disposition": {
        "attempt_set_sha256": "18138773297e9f4e95ef32420be39bc9ee65005fc78592d75a2fa5cd9cd0ccbe",
        "attempts_total": 1,
        "distinct_terminal_result_signature_count": 1,
        "inconclusive_attempt_count": 0,
        "last_attempt_id": "rcid:v1:physical-run:u7:019ffdee-0000-7000-8000-000000000001",
        "logical_execution_id": "rcid:v1:logical-execution:h:jcs-sha256-v1:0000000000000000000000000000000000000000000000000000000000000001",
        "observation_ids": [
          "rcid:v1:observation:u7:019ffdee-0000-7000-8000-000000000001"
        ],
        "recovered_attempt_count": 0,
        "repeat_measurement_attempt_count": 0,
        "retry_attempt_count": 0,
        "retry_budget_exhausted": false,
        "satisfaction_attempt_id": "rcid:v1:physical-run:u7:019ffdee-0000-7000-8000-000000000001",
        "satisfaction_observation_id": "rcid:v1:observation:u7:019ffdee-0000-7000-8000-000000000001",
        "schema_version": "logical-execution-disposition.v1",
        "status": "satisfied",
        "terminal_attempt_count": 1,
        "terminal_result_signatures": [
          {
            "observation_count": 1,
            "observation_ids": [
              "rcid:v1:observation:u7:019ffdee-0000-7000-8000-000000000001"
            ],
            "sha256": "ca01757df60734eabb5ef43c7d4674ee2a5bec519409a15c0ac746c291194cf1"
          }
        ],
        "unresolved_reason": null
      },
      "logical_execution_id": "rcid:v1:logical-execution:h:jcs-sha256-v1:0000000000000000000000000000000000000000000000000000000000000001",
      "observations": [
        {
          "attempt_set_reference": {
            "attempt_set_sha256": "18138773297e9f4e95ef32420be39bc9ee65005fc78592d75a2fa5cd9cd0ccbe",
            "attempts_total": 1
          },
          "campaign_manifest_id": "rcid:v1:campaign-manifest:h:jcs-sha256-v1:0000000000000000000000000000000000000000000000000000000000000001",
          "derivation_revision_ids": [],
          "fault_attribution": {
            "attribution_layer": "target",
            "evidence_reference": null,
            "reason_code": "bounded-target-evidence",
            "target_attributable": true
          },
          "logical_execution_id": "rcid:v1:logical-execution:h:jcs-sha256-v1:0000000000000000000000000000000000000000000000000000000000000001",
          "observation_complete": true,
          "observation_content_id": "rcid:v1:observation-content:h:jcs-sha256-v1:1bfeabfde928be2459a22b2d08b3e87668683cb49c2a5ff6164978d23f0be8ee",
          "observation_id": "rcid:v1:observation:u7:019ffdee-0000-7000-8000-000000000001",
          "outcome_class": "match",
          "physical_telemetry_references": [
            {
              "category": "physical-telemetry",
              "relative_path": "physical-telemetry/sha256/0000000000000000000000000000000000000000000000000000000000000001.json",
              "sha256": "0000000000000000000000000000000000000000000000000000000000000001",
              "size_bytes": 1
            }
          ],
          "protocol_valid": true,
          "result_signature": {
            "algorithm": "rfc8785-sha256-v1",
            "basis": "outcome-class-and-semantic-result",
            "sha256": "ca01757df60734eabb5ef43c7d4674ee2a5bec519409a15c0ac746c291194cf1"
          },
          "schema_version": "terminal-observation-content.v2",
          "semantic_result": {
            "match": true,
            "spans": [
              [
                0,
                1
              ]
            ]
          },
          "terminal_attempt_id": "rcid:v1:physical-run:u7:019ffdee-0000-7000-8000-000000000001"
        }
      ]
    },
    {
      "attempts": [
        {
          "attempt_ordinal": 1,